{
  "schema_version": 1,
  "id": "card_tower_cinder",
  "placeholder": true,
  "type": "new_tower",
  "name_key": "card.card_tower_cinder.name",
  "desc_key": "card.card_tower_cinder.desc",
  "max_picks": 1,
  "requires": {"unlocked": "waifu_cinder"},
  "effects": [{"stat": "unlock_tower", "op": "add", "value": 1, "target": "tower:tower_cinder"}]
}
