{
  "schema_version": 1,
  "id": "card_sig_cinder",
  "placeholder": true,
  "type": "signature",
  "name_key": "card.card_sig_cinder.name",
  "desc_key": "card.card_sig_cinder.desc",
  "max_picks": 1,
  "requires": {"buildable": "waifu_cinder"},
  "effects": [{"stat": "unlock_level", "op": "add", "value": 4, "target": "tower:tower_cinder"}]
}
