{
  "schema_version": 1,
  "id": "card_tower_tansy",
  "placeholder": true,
  "type": "new_tower",
  "name_key": "card.card_tower_tansy.name",
  "desc_key": "card.card_tower_tansy.desc",
  "max_picks": 1,
  "requires": {"unlocked": "waifu_tansy"},
  "effects": [{"stat": "unlock_tower", "op": "add", "value": 1, "target": "tower:tower_tansy"}]
}
