{
  "schema_version": 1,
  "id": "card_sig_bastia",
  "placeholder": true,
  "type": "signature",
  "name_key": "card.card_sig_bastia.name",
  "desc_key": "card.card_sig_bastia.desc",
  "max_picks": 1,
  "requires": {"buildable": "waifu_bastia"},
  "effects": [{"stat": "unlock_level", "op": "add", "value": 4, "target": "tower:tower_bastia"}]
}
