{
  "schema_version": 1,
  "id": "card_tower_bastia",
  "placeholder": true,
  "type": "new_tower",
  "name_key": "card.card_tower_bastia.name",
  "desc_key": "card.card_tower_bastia.desc",
  "max_picks": 1,
  "requires": {"unlocked": "waifu_bastia"},
  "effects": [{"stat": "unlock_tower", "op": "add", "value": 1, "target": "tower:tower_bastia"}]
}
