{
  "schema_version": 1,
  "id": "card_tower_hymn",
  "placeholder": true,
  "type": "new_tower",
  "name_key": "card.card_tower_hymn.name",
  "desc_key": "card.card_tower_hymn.desc",
  "max_picks": 1,
  "requires": {"unlocked": "waifu_hymn"},
  "effects": [{"stat": "unlock_tower", "op": "add", "value": 1, "target": "tower:tower_hymn"}]
}
