{
  "schema_version": 1,
  "id": "card_tower_clover",
  "placeholder": true,
  "type": "new_tower",
  "name_key": "card.card_tower_clover.name",
  "desc_key": "card.card_tower_clover.desc",
  "max_picks": 1,
  "requires": {"unlocked": "waifu_clover"},
  "effects": [{"stat": "unlock_tower", "op": "add", "value": 1, "target": "tower:tower_clover"}]
}
