{
  "schema_version": 1,
  "id": "card_sig_mallow",
  "placeholder": true,
  "type": "signature",
  "name_key": "card.card_sig_mallow.name",
  "desc_key": "card.card_sig_mallow.desc",
  "max_picks": 1,
  "requires": {"buildable": "waifu_mallow"},
  "effects": [{"stat": "unlock_level", "op": "add", "value": 4, "target": "tower:tower_mallow"}]
}
